{
  "schema_version": 2,
  "event_type": "transcription.status",
  "session_id": "session-demo-01",
  "character_id": "test-vrm-01",
  "status": "final",
  "timestamp": "2026-05-14T08:57:41Z",
  "transcription": {
    "profile_id": "stt.faster-whisper.medium-2026",
    "status": "final",
    "locale": "en-US",
    "transcript": "Hey Niko, can you wave after you answer?",
    "confidence": 0.98,
    "timing": {
      "utterance_duration_ms": 1890,
      "segment_ranges": [
        {
          "start_ms": 0,
          "end_ms": 640,
          "text": "Hey Niko,"
        },
        {
          "start_ms": 640,
          "end_ms": 1890,
          "text": "can you wave after you answer?"
        }
      ],
      "audio_format": {
        "container": "wav",
        "encoding": "pcm_s16le",
        "sample_rate_hz": 16000,
        "channels": 1
      }
    }
  }
}