{
  "schema_version": 2,
  "event_type": "speech.synthesis",
  "session_id": "session-demo-01",
  "character_id": "test-vrm-01",
  "status": "ready",
  "timestamp": "2026-05-14T08:57:41Z",
  "synthesis": {
    "profile_id": "tts.gpt-sovits.2026-stable",
    "status": "ready",
    "text": "Sure. I can wave once I finish speaking.",
    "locale": "en-US",
    "utterance_id": "utterance-demo-01",
    "segment_index": 0,
    "segment_count": 1,
    "is_final": true,
    "timing": {
      "utterance_duration_ms": 2120,
      "segment_ranges": [
        {
          "start_ms": 0,
          "end_ms": 880,
          "text": "Sure."
        },
        {
          "start_ms": 880,
          "end_ms": 2120,
          "text": "I can wave once I finish speaking."
        }
      ],
      "audio_format": {
        "container": "wav",
        "encoding": "pcm_s16le",
        "sample_rate_hz": 24000,
        "channels": 1
      },
      "phoneme_slots": [
        {
          "phoneme": "S",
          "start_ms": 0,
          "end_ms": 110
        },
        {
          "phoneme": "UH",
          "start_ms": 110,
          "end_ms": 260
        }
      ],
      "viseme_slots": [
        {
          "viseme": "sil",
          "start_ms": 0,
          "end_ms": 45
        },
        {
          "viseme": "smile",
          "start_ms": 45,
          "end_ms": 310
        }
      ]
    }
  }
}